{
  "uuid": "019dc7e3-fb5b-7366-99c0-fc8d004cf018",
  "from": "019bc119-0100-7266-97fb-d735facdf2d2",
  "space": "com.acme.store",
  "type": "pong",
  "level": 8,
  "sid": 0,
  "step": 0,
  "event": {
    "uts": 1777175100,
    "sub": 251870412,
    "iso": "2026-04-26T03:45:00.251Z"
  },
  "payload": {
    "ref": "019dc7e3-fb5a-7000-8003-cc8f6a84de00"
  }
}
