{
  "uuid": "019dc7e3-1838-722e-adb2-c9b225de82d8",
  "from": "019bc119-0100-7266-97fb-d735facdf2d2",
  "space": "intranet",
  "type": "access-log",
  "level": 6,
  "sid": 30117,
  "step": 0,
  "event": {
    "uts": 1325295431,
    "sub": 919000000,
    "iso": "2011-12-31T01:37:11.919Z"
  },
  "payload": {
    "file": "/var/log/archive/access.log.2011-12-31",
    "offset": 18230,
    "line": "10.0.0.7 - - [31/Dec/2011:01:37:11 +0000] \"GET /index.html HTTP/1.1\" 200 5120"
  }
}
