{
  "uuid": "019dc7e4-0fdd-7387-9790-80a41ecbc9d9",
  "from": "019bc119-0100-7266-97fb-d735facdf2d2",
  "space": "com.acme.store",
  "type": "pong",
  "level": 9,
  "sid": 0,
  "step": 0,
  "event": {
    "uts": 1777175105,
    "sub": 501903377,
    "iso": "2026-04-26T03:45:05.501Z"
  },
  "payload": {
    "ref": "019dc7e4-0fdc-7000-8007-f121b929c6d9",
    "seq": 1,
    "pad": "0123456789abcdef"
  }
}
